{
  "seed_id": "tiny-asteroid-gardening",
  "chosen_loop_id": "loop-a",
  "summary": "Tracer-bullet decomposition of the plant/water/rotate loop into falsifiable co-dev slices.",
  "out_of_scope": ["content expansion", "high-fidelity art", "multiplayer"],
  "slices": [
    {
      "id": "tracer-loop",
      "title": "Tracer bullet: one asteroid, plant + water + rotate",
      "type": "slice",
      "order": 1,
      "goal": "Prove the three core verbs fit together in the thinnest playable loop.",
      "acceptance": [
        {
          "kind": "mechanical",
          "statement": "A 60s session exercises plant, water, and rotate-asteroid at least once",
          "check": "bot_session_plant_water_rotate"
        },
        {
          "kind": "feel_budget",
          "statement": "Asteroid rotation settles within the rotate-snap budget (120ms)",
          "check": "feel:rotate-snap"
        }
      ],
      "evidence_requirements": ["playtests/**/playtest_report.json from a bot session >= 60s"],
      "depends_on": [],
      "loop_verbs_covered": ["plant", "water", "rotate-asteroid"]
    },
    {
      "id": "sunlight-pressure",
      "title": "Sunlight sweep creates timing pressure",
      "type": "feature",
      "order": 2,
      "goal": "Add the drifting sunlight band so placement order starts to matter.",
      "acceptance": [
        {
          "kind": "visual",
          "statement": "Plants outside the sunlight band wither on a visible timer",
          "check": "screenshot:wither-timer"
        },
        {
          "kind": "mechanical",
          "statement": "Random vs heuristic bot scores diverge measurably across 5 runs",
          "check": "two_bot_score_spread"
        }
      ],
      "evidence_requirements": ["two playtest reports with distinct bot_type values"],
      "depends_on": ["tracer-loop"],
      "loop_verbs_covered": ["plant", "water"]
    }
  ]
}
